<?xml version="1.0" encoding="UTF-8"?>
<xs:schema xmlns:xs="http://www.w3.org/2001/XMLSchema">
    <xs:element name="clientes">
        <xs:complexType>
            <xs:sequence>
                <xs:element name="cliente" maxOccurs="unbounded">
                    <xs:complexType>
                        <xs:sequence>
                            <xs:element name="nombre" type="xs:string"/>
                            <xs:element name="apellidos" type="xs:string"/>
                            <xs:element name="dni">
                                <xs:simpleType>
                                    <xs:restriction base="xs:string">
                                        <xs:whiteSpace value="collapse" />
                                        <xs:pattern value="[0-9]{8}[A-Z]" />
                                    </xs:restriction>
                                </xs:simpleType>
                            </xs:element>
                            <xs:element name="edad" type="xs:string"/>
                            <xs:element name="direccion">
                                <xs:complexType>
                                    <xs:sequence>
                                        <xs:element name="calle" type="xs:string"/>
                                        <xs:element name="numero" type="xs:unsignedInt"/>
                                        <xs:element name="bloque" type="xs:unsignedInt" minOccurs="0"/>
                                        <xs:element name="piso" type="xs:unsignedInt" minOccurs="0"/>
                                        <xs:element name="puerta" type="xs:string" minOccurs="0"/>
                                    </xs:sequence>
                                </xs:complexType>
                            </xs:element>
                            <xs:element name="telefono" type="xs:string" maxOccurs="3"/>
                        </xs:sequence>
                        <xs:attribute name="codigo" type="xs:string"/>
                    </xs:complexType>
                </xs:element>
            </xs:sequence>
        </xs:complexType>
    </xs:element>
</xs:schema>